{
  "schema_version": 1,
  "id": "simulation-codex-evaluation-smoke",
  "title": "Simulation Codex evaluation smoke",
  "purpose": "Prove independent read-only Codex evaluation of one frozen deterministic simulation run without broadening its release scope.",
  "owner_lane": "W-004",
  "tier": "semantic-evaluation",
  "evaluation_profile_file": "product-evals/rubrics/codex-independent-v1.json",
  "simulation_file": "product-evals/simulations/harness/simulation-correctness-fixture/manifest.json",
  "task_files": [
    "product-evals/tasks/SIMULATION-STATE-SMOKE.json"
  ],
  "claim_files": [
    "product-evals/claims/fixture-state-transition.json",
    "product-evals/claims/fixture-population-coverage.json",
    "product-evals/claims/fixture-release-eligibility.json"
  ],
  "policy_files": [
    "product-evals/policies/allow-fixture-state-actions-v1.json"
  ],
  "oracle_files": [
    "product-evals/oracles/account-resolved-v1.json",
    "product-evals/oracles/account-attempt-recorded-v1.json"
  ]
}
